{
  "id": "showcase-60s",
  "version": 1,
  "status": "render-ready",
  "meta": {
    "title": "Cat Cafe showcase-60s",
    "target_duration_ms": 57000,
    "fps": 30,
    "resolution": {
      "width": 1920,
      "height": 1080
    }
  },
  "global_audio": {
    "script_text": "Cat Cafe，是四只 AI 猫猫组成的开发团队。\n\n你发一条消息，它们同时开始思考——\n布偶猫负责架构，缅因猫做 code review，暹罗猫管设计，各有分工，自主协作。\n\n飞书发一条，Hub 同步收到。\n在任何一端说话，所有端都能看到。\n\n更特别的是，每只猫有自己的声音。\n你可以听到它们用各自的声线，念给你听。\n\n写前端代码？猫改完，右边浏览器立刻刷新。\n所见即所得，设计和实现，零距离。\n\n它们还有记忆。\n搜一个两周前的讨论，三秒命中——这不是搜索，是经验的沉淀。\n\n最后，猫猫不只是回复文字。\n卡片、清单、投票、代码 diff，信息有结构，交互有温度。\n\n这就是 Cat Cafe。",
    "speaker_id": "opus",
    "audio_uri": "assets/global-narration.wav",
    "word_timestamps": [
      {
        "index": 0,
        "word": "Cat",
        "start_ms": 5280,
        "end_ms": 5520
      },
      {
        "index": 1,
        "word": "Cafe",
        "start_ms": 5520,
        "end_ms": 6160
      },
      {
        "index": 2,
        "word": "是",
        "start_ms": 6560,
        "end_ms": 6720
      },
      {
        "index": 3,
        "word": "四",
        "start_ms": 6720,
        "end_ms": 6960
      },
      {
        "index": 4,
        "word": "只",
        "start_ms": 6960,
        "end_ms": 7200
      },
      {
        "index": 5,
        "word": "AI",
        "start_ms": 7200,
        "end_ms": 7520
      },
      {
        "index": 6,
        "word": "猫",
        "start_ms": 7520,
        "end_ms": 7680
      },
      {
        "index": 7,
        "word": "猫",
        "start_ms": 7680,
        "end_ms": 7840
      },
      {
        "index": 8,
        "word": "组",
        "start_ms": 7840,
        "end_ms": 8000
      },
      {
        "index": 9,
        "word": "成",
        "start_ms": 8000,
        "end_ms": 8160
      },
      {
        "index": 10,
        "word": "的",
        "start_ms": 8160,
        "end_ms": 8240
      },
      {
        "index": 11,
        "word": "开",
        "start_ms": 8240,
        "end_ms": 8400
      },
      {
        "index": 12,
        "word": "发",
        "start_ms": 8400,
        "end_ms": 8560
      },
      {
        "index": 13,
        "word": "团",
        "start_ms": 8560,
        "end_ms": 8720
      },
      {
        "index": 14,
        "word": "队",
        "start_ms": 8720,
        "end_ms": 8960
      },
      {
        "index": 15,
        "word": "你",
        "start_ms": 10160,
        "end_ms": 10320
      },
      {
        "index": 16,
        "word": "发",
        "start_ms": 10320,
        "end_ms": 10480
      },
      {
        "index": 17,
        "word": "一",
        "start_ms": 10480,
        "end_ms": 10480
      },
      {
        "index": 18,
        "word": "条",
        "start_ms": 10480,
        "end_ms": 10640
      },
      {
        "index": 19,
        "word": "消",
        "start_ms": 10640,
        "end_ms": 10880
      },
      {
        "index": 20,
        "word": "息",
        "start_ms": 10880,
        "end_ms": 11200
      },
      {
        "index": 21,
        "word": "它",
        "start_ms": 11440,
        "end_ms": 11600
      },
      {
        "index": 22,
        "word": "们",
        "start_ms": 11600,
        "end_ms": 11680
      },
      {
        "index": 23,
        "word": "同",
        "start_ms": 11680,
        "end_ms": 11840
      },
      {
        "index": 24,
        "word": "时",
        "start_ms": 11840,
        "end_ms": 12000
      },
      {
        "index": 25,
        "word": "开",
        "start_ms": 12000,
        "end_ms": 12160
      },
      {
        "index": 26,
        "word": "始",
        "start_ms": 12160,
        "end_ms": 12240
      },
      {
        "index": 27,
        "word": "思",
        "start_ms": 12240,
        "end_ms": 12480
      },
      {
        "index": 28,
        "word": "考",
        "start_ms": 12480,
        "end_ms": 12800
      },
      {
        "index": 29,
        "word": "布",
        "start_ms": 13120,
        "end_ms": 13280
      },
      {
        "index": 30,
        "word": "偶",
        "start_ms": 13280,
        "end_ms": 13440
      },
      {
        "index": 31,
        "word": "猫",
        "start_ms": 13440,
        "end_ms": 13600
      },
      {
        "index": 32,
        "word": "负",
        "start_ms": 13600,
        "end_ms": 13760
      },
      {
        "index": 33,
        "word": "责",
        "start_ms": 13760,
        "end_ms": 13920
      },
      {
        "index": 34,
        "word": "架",
        "start_ms": 13920,
        "end_ms": 14080
      },
      {
        "index": 35,
        "word": "构",
        "start_ms": 14080,
        "end_ms": 14400
      },
      {
        "index": 36,
        "word": "缅",
        "start_ms": 14880,
        "end_ms": 15120
      },
      {
        "index": 37,
        "word": "因",
        "start_ms": 15120,
        "end_ms": 15200
      },
      {
        "index": 38,
        "word": "猫",
        "start_ms": 15200,
        "end_ms": 15440
      },
      {
        "index": 39,
        "word": "做",
        "start_ms": 15440,
        "end_ms": 15600
      },
      {
        "index": 40,
        "word": "code",
        "start_ms": 15600,
        "end_ms": 15840
      },
      {
        "index": 41,
        "word": "review",
        "start_ms": 15840,
        "end_ms": 16320
      },
      {
        "index": 42,
        "word": "暹",
        "start_ms": 16560,
        "end_ms": 16800
      },
      {
        "index": 43,
        "word": "罗",
        "start_ms": 16800,
        "end_ms": 16960
      },
      {
        "index": 44,
        "word": "猫",
        "start_ms": 16960,
        "end_ms": 17120
      },
      {
        "index": 45,
        "word": "管",
        "start_ms": 17120,
        "end_ms": 17280
      },
      {
        "index": 46,
        "word": "设",
        "start_ms": 17280,
        "end_ms": 17520
      },
      {
        "index": 47,
        "word": "计",
        "start_ms": 17520,
        "end_ms": 17760
      },
      {
        "index": 48,
        "word": "各",
        "start_ms": 17920,
        "end_ms": 18080
      },
      {
        "index": 49,
        "word": "有",
        "start_ms": 18080,
        "end_ms": 18240
      },
      {
        "index": 50,
        "word": "分",
        "start_ms": 18240,
        "end_ms": 18400
      },
      {
        "index": 51,
        "word": "工",
        "start_ms": 18400,
        "end_ms": 18720
      },
      {
        "index": 52,
        "word": "自",
        "start_ms": 18800,
        "end_ms": 18960
      },
      {
        "index": 53,
        "word": "主",
        "start_ms": 18960,
        "end_ms": 19120
      },
      {
        "index": 54,
        "word": "协",
        "start_ms": 19120,
        "end_ms": 19280
      },
      {
        "index": 55,
        "word": "作",
        "start_ms": 19280,
        "end_ms": 19600
      },
      {
        "index": 56,
        "word": "飞",
        "start_ms": 20080,
        "end_ms": 20320
      },
      {
        "index": 57,
        "word": "书",
        "start_ms": 20320,
        "end_ms": 20480
      },
      {
        "index": 58,
        "word": "发",
        "start_ms": 20480,
        "end_ms": 20640
      },
      {
        "index": 59,
        "word": "一",
        "start_ms": 20640,
        "end_ms": 20720
      },
      {
        "index": 60,
        "word": "条",
        "start_ms": 20720,
        "end_ms": 21120
      },
      {
        "index": 61,
        "word": "Hub",
        "start_ms": 21200,
        "end_ms": 21440
      },
      {
        "index": 62,
        "word": "同",
        "start_ms": 21520,
        "end_ms": 21760
      },
      {
        "index": 63,
        "word": "步",
        "start_ms": 21760,
        "end_ms": 21840
      },
      {
        "index": 64,
        "word": "收",
        "start_ms": 21840,
        "end_ms": 22000
      },
      {
        "index": 65,
        "word": "到",
        "start_ms": 22000,
        "end_ms": 22240
      },
      {
        "index": 66,
        "word": "在",
        "start_ms": 22560,
        "end_ms": 22720
      },
      {
        "index": 67,
        "word": "任",
        "start_ms": 22720,
        "end_ms": 22880
      },
      {
        "index": 68,
        "word": "何",
        "start_ms": 22880,
        "end_ms": 23040
      },
      {
        "index": 69,
        "word": "一",
        "start_ms": 23040,
        "end_ms": 23120
      },
      {
        "index": 70,
        "word": "端",
        "start_ms": 23120,
        "end_ms": 23280
      },
      {
        "index": 71,
        "word": "说",
        "start_ms": 23280,
        "end_ms": 23440
      },
      {
        "index": 72,
        "word": "话",
        "start_ms": 23440,
        "end_ms": 23680
      },
      {
        "index": 73,
        "word": "所",
        "start_ms": 23840,
        "end_ms": 24080
      },
      {
        "index": 74,
        "word": "有",
        "start_ms": 24080,
        "end_ms": 24240
      },
      {
        "index": 75,
        "word": "端",
        "start_ms": 24240,
        "end_ms": 24400
      },
      {
        "index": 76,
        "word": "都",
        "start_ms": 24400,
        "end_ms": 24480
      },
      {
        "index": 77,
        "word": "能",
        "start_ms": 24480,
        "end_ms": 24640
      },
      {
        "index": 78,
        "word": "看",
        "start_ms": 24640,
        "end_ms": 24880
      },
      {
        "index": 79,
        "word": "到",
        "start_ms": 24880,
        "end_ms": 25040
      },
      {
        "index": 80,
        "word": "更",
        "start_ms": 25520,
        "end_ms": 25680
      },
      {
        "index": 81,
        "word": "特",
        "start_ms": 25680,
        "end_ms": 25840
      },
      {
        "index": 82,
        "word": "别",
        "start_ms": 25840,
        "end_ms": 26000
      },
      {
        "index": 83,
        "word": "的",
        "start_ms": 26000,
        "end_ms": 26080
      },
      {
        "index": 84,
        "word": "是",
        "start_ms": 26080,